{
  "schemaVersion": 2,
  "id": "27af4f39-c893-41e6-a4bb-451f1dc3b223",
  "legacyIds": [
    "drink_6cd87843"
  ],
  "name": "酒酿醪糟",
  "description": "这是一道传统中式发酵甜品，口感清甜微醺，带着淡淡的酒香。具有健脾开胃、促进消化的作用。制作过程简单有趣，虽然需要等待发酵，但动手操作并不复杂，非常适合作为发酵入门。预计制作总时长约 2 天，其中实际动手时间仅需 大约 1 小时。",
  "category": "drink",
  "categoryName": "饮料",
  "difficulty": 4,
  "estimatedCaloriesKcal": 420,
  "requirements": [
    {
      "text": "糯米 800g（推荐使用圆糯米）",
      "markdown": "糯米 800g（推荐使用圆糯米）",
      "group": null,
      "kind": "unknown"
    },
    {
      "text": "安琪甜酒曲一包 (8g)（虽然按比例为每 1000g 糯米用 3g，但多放酒曲能提高成功概率）",
      "markdown": "安琪甜酒曲一包 (8g)（虽然按比例为每 1000g 糯米用 3g，但多放酒曲能提高成功概率）",
      "group": null,
      "kind": "unknown"
    },
    {
      "text": "清水 720g + 600g（720 克用于蒸饭，后 500g 用于发酵）",
      "markdown": "清水 720g + 600g（720 克用于蒸饭，后 500g 用于发酵）",
      "group": null,
      "kind": "unknown"
    },
    {
      "text": "蒸锅（电饭煲即可）",
      "markdown": "蒸锅（电饭煲即可）",
      "group": null,
      "kind": "unknown"
    },
    {
      "text": "温度计（可选但推荐）",
      "markdown": "温度计（可选但推荐）",
      "group": null,
      "kind": "unknown"
    },
    {
      "text": "干净密封玻璃或陶瓷容器 1 个",
      "markdown": "干净密封玻璃或陶瓷容器 1 个",
      "group": null,
      "kind": "unknown"
    }
  ],
  "requirementsMarkdown": "- 糯米 800g（推荐使用圆糯米）\r\n- 安琪甜酒曲一包 (8g)（虽然按比例为每 1000g 糯米用 3g，但多放酒曲能提高成功概率）\r\n- 清水 720g + 600g（720 克用于蒸饭，后 500g 用于发酵）\r\n- 蒸锅（电饭煲即可）\r\n- 温度计（可选但推荐）\r\n- 干净密封玻璃或陶瓷容器 1 个",
  "ingredients": [
    {
      "name": "糯米",
      "text": "糯米 800g（推荐使用圆糯米）",
      "optional": false,
      "source": "requirements-fallback"
    },
    {
      "name": "安琪甜酒曲一包 (8g)（虽然按比例为每",
      "text": "安琪甜酒曲一包 (8g)（虽然按比例为每 1000g 糯米用 3g，但多放酒曲能提高成功概率）",
      "optional": false,
      "source": "requirements-fallback"
    },
    {
      "name": "清水",
      "text": "清水 720g + 600g（720 克用于蒸饭，后 500g 用于发酵）",
      "optional": false,
      "source": "requirements-fallback"
    }
  ],
  "tools": [],
  "calculationMarkdown": "本菜谱为 1 份，可供 6～8 人食用。",
  "calculationNotes": [
    "本菜谱为 1 份，可供 6～8 人食用。"
  ],
  "steps": [
    {
      "kind": "step",
      "description": "将 800g 糯米淘洗干净放入电饭煲，加入 720g 清水选择蒸饭模式"
    },
    {
      "kind": "step",
      "description": "蒸熟后将米饭倒出摊凉，使用干净的工具将其摊至 30°C （用温度计测量为宜，体感温热但不烫手）"
    },
    {
      "kind": "step",
      "description": "将 8g 安琪甜酒曲用 20ml 温水（约 30°C）化开，均匀撒在糯米饭中，同时翻拌均匀"
    },
    {
      "kind": "step",
      "description": "向糯米饭中加入 600g 清水帮助酒曲翻拌均匀。静置 2-3 分钟后发现糯米饭吸饱水分。这次加水可以让酒酿首次发酵便汤汁丰富"
    },
    {
      "kind": "step",
      "description": "用擀面杖在糯米饭中央挖一个小洞（便于出酒）"
    },
    {
      "kind": "step",
      "description": "将混合好的米饭装入干净容器中，轻轻压平表面，盖上盖子或保鲜膜密封好"
    },
    {
      "kind": "step",
      "description": "放置于 28 ～ 32°C 环境下发酵 24 ～ 48 小时。发酵期间不可剧烈摇晃或移动"
    },
    {
      "kind": "step",
      "description": "发酵成功标准为：中间凹槽有透明酒液渗出，整体略带酒香，无异味、不酸败"
    },
    {
      "kind": "step",
      "description": "发酵结束后可立即冷藏保存（过程中可以加入桂花），每次食用用干净工具取出，可冷藏保存 7 ～ 10 天"
    },
    {
      "kind": "step",
      "description": "可以继续二次发酵，加入 500ml 清水增加酒酿产量（800g 水以内即可）"
    },
    {
      "kind": "step",
      "description": "酒酿会一直持续发酵。如果想停止发酵，可以上锅蒸 10 分钟杀菌，或放入冰箱冷藏"
    },
    {
      "kind": "section",
      "title": "进阶版本 1：提前泡米版本",
      "description": "### 进阶版本 1：提前泡米版本"
    },
    {
      "kind": "step",
      "description": "将 800g 糯米淘洗干净，倒入清水中浸泡 6 ～ 8 小时（冬季建议泡 8 ～ 10 小时），泡至米粒饱满"
    },
    {
      "kind": "step",
      "description": "沥干糯米，放入蒸布中，隔水蒸 40 ～ 60 分钟。每 20 分钟打开锅盖翻动一次确保蒸熟均匀"
    },
    {
      "kind": "step",
      "description": "蒸熟后将米饭倒出摊凉，加入酒曲，后续步骤同上"
    },
    {
      "kind": "section",
      "title": "进阶版本 2：混合米",
      "description": "### 进阶版本 2：混合米"
    },
    {
      "kind": "step",
      "description": "当然，酒酿老手可以随意尝试不同米搭配。可以替换 20%的糯米为小米、燕麦、黄米、血糯米等"
    }
  ],
  "operationMarkdown": "1. 将 800g 糯米淘洗干净放入电饭煲，加入 720g 清水选择蒸饭模式\r\n2. 蒸熟后将米饭倒出摊凉，使用干净的工具将其摊至 30°C （用温度计测量为宜，体感温热但不烫手）\r\n3. 将 8g 安琪甜酒曲用 20ml 温水（约 30°C）化开，均匀撒在糯米饭中，同时翻拌均匀\r\n4. 向糯米饭中加入 600g 清水帮助酒曲翻拌均匀。静置 2-3 分钟后发现糯米饭吸饱水分。这次加水可以让酒酿首次发酵便汤汁丰富\r\n5. 用擀面杖在糯米饭中央挖一个小洞（便于出酒）\r\n6. 将混合好的米饭装入干净容器中，轻轻压平表面，盖上盖子或保鲜膜密封好\r\n7. 放置于 28 ～ 32°C 环境下发酵 24 ～ 48 小时。发酵期间不可剧烈摇晃或移动\r\n8. 发酵成功标准为：中间凹槽有透明酒液渗出，整体略带酒香，无异味、不酸败\r\n9. 发酵结束后可立即冷藏保存（过程中可以加入桂花），每次食用用干净工具取出，可冷藏保存 7 ～ 10 天\r\n\r\n10. 可以继续二次发酵，加入 500ml 清水增加酒酿产量（800g 水以内即可）\r\n11. 酒酿会一直持续发酵。如果想停止发酵，可以上锅蒸 10 分钟杀菌，或放入冰箱冷藏\r\n\r\n### 进阶版本 1：提前泡米版本\r\n\r\n1. 将 800g 糯米淘洗干净，倒入清水中浸泡 6 ～ 8 小时（冬季建议泡 8 ～ 10 小时），泡至米粒饱满\r\n2. 沥干糯米，放入蒸布中，隔水蒸 40 ～ 60 分钟。每 20 分钟打开锅盖翻动一次确保蒸熟均匀\r\n3. 蒸熟后将米饭倒出摊凉，加入酒曲，后续步骤同上\r\n\r\n### 进阶版本 2：混合米\r\n\r\n1. 当然，酒酿老手可以随意尝试不同米搭配。可以替换 20%的糯米为小米、燕麦、黄米、血糯米等",
  "tips": "- 发酵温度至关重要，低温会发酵缓慢或失败，高温会杀死酒曲\r\n- 发酵失败常见原因：温度过高、米饭太热时拌入酒曲、容器未清洁干净或进水进油\r\n- 可搭配汤圆、蛋花、枸杞等加热食用，但注意不要煮沸时间过长以免酒香散失\r\n- 酒酿汁可用于制作酒酿米糕、酒酿饼等，还可以用作调料为肥牛饭、照烧汁增添风味\r\n![酒酿米糕](./酒酿米糕.jpeg)\r\n\r\n如果您遵循本指南的制作流程而发现有问题或可以改进的流程，请提出 Issue 或 Pull request 。",
  "warnings": [],
  "additionalMarkdown": "- 发酵温度至关重要，低温会发酵缓慢或失败，高温会杀死酒曲\r\n- 发酵失败常见原因：温度过高、米饭太热时拌入酒曲、容器未清洁干净或进水进油\r\n- 可搭配汤圆、蛋花、枸杞等加热食用，但注意不要煮沸时间过长以免酒香散失\r\n- 酒酿汁可用于制作酒酿米糕、酒酿饼等，还可以用作调料为肥牛饭、照烧汁增添风味\r\n![酒酿米糕](./酒酿米糕.jpeg)\r\n\r\n如果您遵循本指南的制作流程而发现有问题或可以改进的流程，请提出 Issue 或 Pull request 。",
  "images": [
    "images/drink/27af4f39-c893-41e6-a4bb-451f1dc3b223_0.webp",
    "images/drink/27af4f39-c893-41e6-a4bb-451f1dc3b223_1.webp"
  ],
  "externalImages": [],
  "source": {
    "repository": "https://github.com/Gaq152/HowToCook",
    "commit": "c05758fa661ac4efa0361a987b700a351a22159b",
    "path": "dishes/drink/酒酿醪糟/酒酿醪糟.md"
  },
  "hash": "03f77573cdd81d8a268ce6303516efffae0d5f6b3d8d104e6fb45fb16acf9130"
}
