{
  "schemaVersion": 2,
  "id": "27357681-47de-4aa5-bacb-345bfba07158",
  "legacyIds": [
    "meat_dish_3ca3f659"
  ],
  "name": "干煸仔鸡",
  "description": "这是一道源自北大食堂、甜辣风味的创新川菜，鸡肉先腌后炸，外酥里嫩，土豆香糯，青椒脆爽，裹满红亮的甜辣酱汁，咸甜微辣十分开胃。富含蛋白质、碳水化合物及维生素。制作涉及油炸和酱汁熬制，对新手稍有挑战，但按步骤操作即可成功，全程约需 1 小时。",
  "category": "meat_dish",
  "categoryName": "荤菜",
  "difficulty": 4,
  "estimatedCaloriesKcal": 1300,
  "requirements": [
    {
      "text": "鸡腿",
      "markdown": "鸡腿",
      "group": null,
      "kind": "unknown"
    },
    {
      "text": "土豆",
      "markdown": "土豆",
      "group": null,
      "kind": "unknown"
    },
    {
      "text": "青椒",
      "markdown": "青椒",
      "group": null,
      "kind": "unknown"
    },
    {
      "text": "大蒜",
      "markdown": "大蒜",
      "group": null,
      "kind": "unknown"
    },
    {
      "text": "盐",
      "markdown": "盐",
      "group": null,
      "kind": "unknown"
    },
    {
      "text": "胡椒粉",
      "markdown": "胡椒粉",
      "group": null,
      "kind": "unknown"
    },
    {
      "text": "生抽",
      "markdown": "生抽",
      "group": null,
      "kind": "unknown"
    },
    {
      "text": "老抽",
      "markdown": "老抽",
      "group": null,
      "kind": "unknown"
    },
    {
      "text": "料酒",
      "markdown": "料酒",
      "group": null,
      "kind": "unknown"
    },
    {
      "text": "淀粉",
      "markdown": "淀粉",
      "group": null,
      "kind": "unknown"
    },
    {
      "text": "郫县红油豆瓣酱（注意区分，不是那种棕黄色的豆瓣酱）",
      "markdown": "郫县红油豆瓣酱（注意区分，不是那种棕黄色的豆瓣酱）",
      "group": null,
      "kind": "unknown"
    },
    {
      "text": "白糖",
      "markdown": "白糖",
      "group": null,
      "kind": "unknown"
    },
    {
      "text": "花椒碎",
      "markdown": "花椒碎",
      "group": null,
      "kind": "unknown"
    }
  ],
  "requirementsMarkdown": "- 鸡腿\r\n- 土豆\r\n- 青椒\r\n- 大蒜\r\n- 盐\r\n- 胡椒粉\r\n- 生抽\r\n- 老抽\r\n- 料酒\r\n- 淀粉\r\n- 郫县红油豆瓣酱（注意区分，不是那种棕黄色的豆瓣酱）\r\n- 白糖\r\n- 花椒碎",
  "ingredients": [
    {
      "name": "鸡腿肉",
      "text": "鸡腿肉 400g",
      "optional": false,
      "source": "calculation-list"
    },
    {
      "name": "土豆",
      "text": "土豆 200g",
      "optional": false,
      "source": "calculation-list"
    },
    {
      "name": "青椒",
      "text": "青椒 60g",
      "optional": false,
      "source": "calculation-list"
    },
    {
      "name": "蒜瓣",
      "text": "蒜瓣 10g",
      "optional": false,
      "source": "calculation-list"
    },
    {
      "name": "盐",
      "text": "盐 3g",
      "optional": false,
      "source": "calculation-list"
    },
    {
      "name": "鸡精",
      "text": "鸡精 3g （可选）",
      "optional": true,
      "source": "calculation-list"
    },
    {
      "name": "胡椒粉",
      "text": "胡椒粉 2g",
      "optional": false,
      "source": "calculation-list"
    },
    {
      "name": "生抽",
      "text": "生抽 5g",
      "optional": false,
      "source": "calculation-list"
    },
    {
      "name": "老抽",
      "text": "老抽 2g",
      "optional": false,
      "source": "calculation-list"
    },
    {
      "name": "料酒",
      "text": "料酒 5g",
      "optional": false,
      "source": "calculation-list"
    },
    {
      "name": "淀粉",
      "text": "淀粉 20g",
      "optional": false,
      "source": "calculation-list"
    },
    {
      "name": "郫县红油豆瓣酱",
      "text": "郫县红油豆瓣酱 40g",
      "optional": false,
      "source": "calculation-list"
    },
    {
      "name": "白糖",
      "text": "白糖 30g",
      "optional": false,
      "source": "calculation-list"
    },
    {
      "name": "花椒碎",
      "text": "花椒碎 2g",
      "optional": false,
      "source": "calculation-list"
    }
  ],
  "tools": [],
  "calculationMarkdown": "1-2 人份：\r\n\r\n- 鸡腿肉 400g\r\n- 土豆 200g\r\n- 青椒 60g\r\n- 蒜瓣 10g\r\n- 盐 3g\r\n- 鸡精 3g （可选）\r\n- 胡椒粉 2g\r\n- 生抽 5g\r\n- 老抽 2g\r\n- 料酒 5g\r\n- 淀粉 20g\r\n- 郫县红油豆瓣酱 40g\r\n- 白糖 30g\r\n- 花椒碎 2g",
  "calculationNotes": [
    "1-2 人份："
  ],
  "steps": [
    {
      "kind": "step",
      "description": "鸡腿去骨（如使用鸡腿排可忽略此步骤），鸡腿肉用刀背砸一砸，切成 2cm 的块。"
    },
    {
      "kind": "step",
      "description": "鸡腿肉中加入盐、鸡精（可选）、胡椒粉、生抽、老抽、料酒，抓拌至粘手时加入淀粉拌匀，加入食用油防止粘连，腌制 30 分钟。"
    },
    {
      "kind": "step",
      "description": "土豆去皮，切成 2cm 的块，沸水煮 5 分钟后捞出，控干水分，防止油炸时爆锅。"
    },
    {
      "kind": "step",
      "description": "青椒去籽，切成 2cm 小片，放在笊篱中备用。"
    },
    {
      "kind": "step",
      "description": "锅中加入宽油（根据锅的形状，能没过食材即可），油温烧至 180℃ 时，下入土豆块炸 3 分钟后捞出。"
    },
    {
      "kind": "step",
      "description": "待油温再次升高到 180℃时，下入鸡块炸 2 分钟后捞出。"
    },
    {
      "kind": "step",
      "description": "待油温再次升高到 180℃时，下入鸡块复炸 1 分钟后捞出。"
    },
    {
      "kind": "step",
      "description": "待油温再次升高到 180℃时，下入土豆块复炸 1 分钟后，将锅中的油和土豆块经过笊篱过滤倒出，让笊篱上的青椒片断生。"
    },
    {
      "kind": "step",
      "description": "锅中加入 5ml 食用油，小火煸炒蒜瓣至发黄，下入红油豆瓣酱煸炒出香，下入白糖炒融化，下入花椒碎，加 40ml 清水，不停搅拌至酱汁粘稠。"
    },
    {
      "kind": "step",
      "description": "下入炸好的鸡块、土豆块、青椒片，搅拌均匀后出锅。"
    }
  ],
  "operationMarkdown": "1. 鸡腿去骨（如使用鸡腿排可忽略此步骤），鸡腿肉用刀背砸一砸，切成 2cm 的块。\r\n2. 鸡腿肉中加入盐、鸡精（可选）、胡椒粉、生抽、老抽、料酒，抓拌至粘手时加入淀粉拌匀，加入食用油防止粘连，腌制 30 分钟。\r\n3. 土豆去皮，切成 2cm 的块，沸水煮 5 分钟后捞出，控干水分，防止油炸时爆锅。\r\n4. 青椒去籽，切成 2cm 小片，放在笊篱中备用。\r\n5. 锅中加入宽油（根据锅的形状，能没过食材即可），油温烧至 180℃ 时，下入土豆块炸 3 分钟后捞出。\r\n6. 待油温再次升高到 180℃时，下入鸡块炸 2 分钟后捞出。\r\n7. 待油温再次升高到 180℃时，下入鸡块复炸 1 分钟后捞出。\r\n8. 待油温再次升高到 180℃时，下入土豆块复炸 1 分钟后，将锅中的油和土豆块经过笊篱过滤倒出，让笊篱上的青椒片断生。\r\n9. 锅中加入 5ml 食用油，小火煸炒蒜瓣至发黄，下入红油豆瓣酱煸炒出香，下入白糖炒融化，下入花椒碎，加 40ml 清水，不停搅拌至酱汁粘稠。\r\n10. 下入炸好的鸡块、土豆块、青椒片，搅拌均匀后出锅。",
  "tips": "- 不舍得使用宽油油炸的话，可改用更少的油煎鸡块和土豆块。会增长用时，部分影响口感，但不会影响总体味道。\r\n- 参考资料：[北大餐饮中心官方资讯](https://mp.weixin.qq.com/s/gd7F1bezTyd3OQsUVVur1w)\r\n\r\n如果您遵循本指南的制作流程而发现有问题或可以改进的流程，请提出 Issue 或 Pull request 。",
  "warnings": [],
  "additionalMarkdown": "- 不舍得使用宽油油炸的话，可改用更少的油煎鸡块和土豆块。会增长用时，部分影响口感，但不会影响总体味道。\r\n- 参考资料：[北大餐饮中心官方资讯](https://mp.weixin.qq.com/s/gd7F1bezTyd3OQsUVVur1w)\r\n\r\n如果您遵循本指南的制作流程而发现有问题或可以改进的流程，请提出 Issue 或 Pull request 。",
  "images": [
    "images/meat_dish/27357681-47de-4aa5-bacb-345bfba07158_0.webp"
  ],
  "externalImages": [],
  "source": {
    "repository": "https://github.com/Gaq152/HowToCook",
    "commit": "c05758fa661ac4efa0361a987b700a351a22159b",
    "path": "dishes/meat_dish/干煸仔鸡/干煸仔鸡.md"
  },
  "hash": "eed20bea1c296280d7027e72bc5d625d66ee9cc7d62eedd578fc4a2f37418406"
}
