{
  "schemaVersion": 2,
  "id": "7011494d-372c-43a2-ba22-2c1504bb3f76",
  "legacyIds": [
    "vegetable_dish_ed1125b8"
  ],
  "name": "蚝油三鲜菇",
  "description": "蚝油三鲜菇是一道鲜美滑嫩的家常快手菜，菌菇吸饱蚝油酱汁，口感软滑有嚼劲，带着微微辣意，清爽不腻。富含植物蛋白、膳食纤维和多种维生素，搭配西蓝花营养均衡。制作简单，新手也能轻松掌握，从备料到出锅仅需 大约 15 分钟。",
  "category": "vegetable_dish",
  "categoryName": "素菜",
  "difficulty": 3,
  "estimatedCaloriesKcal": 222,
  "requirements": [
    {
      "text": "香菇",
      "markdown": "香菇",
      "group": null,
      "kind": "unknown"
    },
    {
      "text": "蟹味菇",
      "markdown": "蟹味菇",
      "group": null,
      "kind": "unknown"
    },
    {
      "text": "白玉菇",
      "markdown": "白玉菇",
      "group": null,
      "kind": "unknown"
    },
    {
      "text": "小米辣",
      "markdown": "小米辣",
      "group": null,
      "kind": "unknown"
    },
    {
      "text": "菜椒",
      "markdown": "菜椒",
      "group": null,
      "kind": "unknown"
    },
    {
      "text": "食用油",
      "markdown": "食用油",
      "group": null,
      "kind": "unknown"
    },
    {
      "text": "盐",
      "markdown": "盐",
      "group": null,
      "kind": "unknown"
    },
    {
      "text": "料酒",
      "markdown": "料酒",
      "group": null,
      "kind": "unknown"
    },
    {
      "text": "淀粉",
      "markdown": "淀粉",
      "group": null,
      "kind": "unknown"
    },
    {
      "text": "生抽",
      "markdown": "生抽",
      "group": null,
      "kind": "unknown"
    },
    {
      "text": "鸡精",
      "markdown": "鸡精",
      "group": null,
      "kind": "unknown"
    },
    {
      "text": "香葱",
      "markdown": "香葱",
      "group": null,
      "kind": "unknown"
    },
    {
      "text": "姜末",
      "markdown": "姜末",
      "group": null,
      "kind": "unknown"
    },
    {
      "text": "蚝油",
      "markdown": "蚝油",
      "group": null,
      "kind": "unknown"
    },
    {
      "text": "西蓝花",
      "markdown": "西蓝花",
      "group": null,
      "kind": "unknown"
    }
  ],
  "requirementsMarkdown": "* 香菇\r\n* 蟹味菇\r\n* 白玉菇\r\n* 小米辣\r\n* 菜椒\r\n* 食用油\r\n* 盐\r\n* 料酒\r\n* 淀粉\r\n* 生抽\r\n* 鸡精\r\n* 香葱\r\n* 姜末\r\n* 蚝油\r\n* 西蓝花",
  "ingredients": [
    {
      "name": "鲜香菇",
      "text": "鲜香菇 2 朵",
      "optional": false,
      "source": "calculation-list"
    },
    {
      "name": "蟹味菇",
      "text": "蟹味菇 30 g",
      "optional": false,
      "source": "calculation-list"
    },
    {
      "name": "白玉菇",
      "text": "白玉菇 30 g",
      "optional": false,
      "source": "calculation-list"
    },
    {
      "name": "小米辣",
      "text": "小米辣 1 根",
      "optional": false,
      "source": "calculation-list"
    },
    {
      "name": "菜椒",
      "text": "菜椒 0.5 颗",
      "optional": false,
      "source": "calculation-list"
    },
    {
      "name": "食用油",
      "text": "食用油 10 ml",
      "optional": false,
      "source": "calculation-list"
    },
    {
      "name": "食用盐",
      "text": "食用盐 5 g",
      "optional": false,
      "source": "calculation-list"
    },
    {
      "name": "料酒",
      "text": "料酒 2 ml",
      "optional": false,
      "source": "calculation-list"
    },
    {
      "name": "淀粉",
      "text": "淀粉 10 g",
      "optional": false,
      "source": "calculation-list"
    },
    {
      "name": "生抽",
      "text": "生抽 10 ml",
      "optional": false,
      "source": "calculation-list"
    },
    {
      "name": "鸡精",
      "text": "鸡精 3 g",
      "optional": false,
      "source": "calculation-list"
    },
    {
      "name": "香葱",
      "text": "香葱 0.5 根",
      "optional": false,
      "source": "calculation-list"
    },
    {
      "name": "姜末",
      "text": "姜末 1 粒",
      "optional": false,
      "source": "calculation-list"
    },
    {
      "name": "蚝油",
      "text": "蚝油 5 ml",
      "optional": false,
      "source": "calculation-list"
    },
    {
      "name": "开水",
      "text": "开水 350 ml",
      "optional": false,
      "source": "calculation-list"
    },
    {
      "name": "西蓝花",
      "text": "西蓝花 100 g",
      "optional": false,
      "source": "calculation-list"
    }
  ],
  "tools": [],
  "calculationMarkdown": "每份：\r\n\r\n* 鲜香菇 2 朵\r\n* 蟹味菇 30 g\r\n* 白玉菇 30 g\r\n* 小米辣 1 根\r\n* 菜椒 0.5 颗\r\n* 食用油 10 ml\r\n* 食用盐 5 g\r\n* 料酒 2 ml\r\n* 淀粉 10 g\r\n* 生抽 10 ml\r\n* 鸡精 3 g\r\n* 香葱 0.5 根\r\n* 姜末 1 粒\r\n* 蚝油 5 ml\r\n* 开水 350 ml\r\n* 西蓝花 100 g",
  "calculationNotes": [
    "每份："
  ],
  "steps": [
    {
      "kind": "step",
      "description": "蟹味菇、白玉菇 去掉根部泥土，掰散菌朵"
    },
    {
      "kind": "step",
      "description": "香菇切片（每片厚度 0.5-1 cm，厚点相对薄点更有嚼劲）"
    },
    {
      "kind": "step",
      "description": "生粉倒入小碗中，加入 50ml 水，搅拌生粉直至融化没有颗粒（即水淀粉）备用"
    },
    {
      "kind": "step",
      "description": "水开，放入西蓝花，清水煮 3 分钟，放入碗中备用"
    },
    {
      "kind": "step",
      "description": "洗锅烧开水，加入 5 g 食用盐，倒入蟹味菇、白玉菇、香菇，水煮 1 分钟"
    },
    {
      "kind": "step",
      "description": "1 分钟后，捞出沥干水分"
    },
    {
      "kind": "step",
      "description": "起锅烧油，待油开始冒小泡，放入姜末、小米辣、菜椒 煸炒 30 S"
    },
    {
      "kind": "step",
      "description": "倒入三鲜菇，然后依次倒入生抽、蚝油、鸡精，翻炒均匀后，倒入水淀粉"
    },
    {
      "kind": "step",
      "description": "中火烧干汁，加入料酒、葱花 出锅"
    },
    {
      "kind": "step",
      "description": "摆上西蓝花"
    }
  ],
  "operationMarkdown": "1. 蟹味菇、白玉菇 去掉根部泥土，掰散菌朵\r\n2. 香菇切片（每片厚度 0.5-1 cm，厚点相对薄点更有嚼劲）\r\n3. 生粉倒入小碗中，加入 50ml 水，搅拌生粉直至融化没有颗粒（即水淀粉）备用\r\n4. 水开，放入西蓝花，清水煮 3 分钟，放入碗中备用\r\n5. 洗锅烧开水，加入 5 g 食用盐，倒入蟹味菇、白玉菇、香菇，水煮 1 分钟\r\n6. 1 分钟后，捞出沥干水分\r\n7. 起锅烧油，待油开始冒小泡，放入姜末、小米辣、菜椒 煸炒 30 S\r\n8. 倒入三鲜菇，然后依次倒入生抽、蚝油、鸡精，翻炒均匀后，倒入水淀粉\r\n9. 中火烧干汁，加入料酒、葱花 出锅\r\n10. 摆上西蓝花\r\n\r\n![蚝油三鲜菇-预览图-1](./1.jpeg)\r\n![蚝油三鲜菇-预览图-2](./2.jpeg)",
  "tips": "如果您遵循本指南的制作流程而发现有问题或可以改进的流程，请提出 Issue 或 Pull request 。",
  "warnings": [],
  "additionalMarkdown": "如果您遵循本指南的制作流程而发现有问题或可以改进的流程，请提出 Issue 或 Pull request 。",
  "images": [
    "images/vegetable_dish/7011494d-372c-43a2-ba22-2c1504bb3f76_0.webp",
    "images/vegetable_dish/7011494d-372c-43a2-ba22-2c1504bb3f76_1.webp"
  ],
  "externalImages": [],
  "source": {
    "repository": "https://github.com/Gaq152/HowToCook",
    "commit": "c05758fa661ac4efa0361a987b700a351a22159b",
    "path": "dishes/vegetable_dish/蚝油三鲜菇/蚝油三鲜菇.md"
  },
  "hash": "ccb7cb5df1b5e8297d63d26c3794f06583328dde799b1732c464cc443d98b677"
}
