{
  "schemaVersion": 2,
  "id": "c0819a92-6029-4c5e-a17f-3ecfce8e5210",
  "legacyIds": [],
  "name": "乾隆白菜",
  "description": "乾隆白菜是一道经典的北京风味凉菜，以手撕白菜心拌上浓稠芝麻酱汁，口感酸甜爽脆、醇厚开胃。白菜富含维生素和膳食纤维，芝麻酱则带来优质脂肪与钙质，清爽解腻又营养。全程不炒不煮，调酱拌匀即可，对新手十分友好，一般仅需 10 分钟便能端上餐桌。",
  "category": "vegetable_dish",
  "categoryName": "素菜",
  "difficulty": 2,
  "estimatedCaloriesKcal": 150,
  "requirements": [
    {
      "text": "大白菜（取黄心嫩叶，冬季黄心白菜最佳）",
      "markdown": "大白菜（取黄心嫩叶，冬季黄心白菜最佳）",
      "group": null,
      "kind": "unknown"
    },
    {
      "text": "芝麻酱",
      "markdown": "芝麻酱",
      "group": null,
      "kind": "unknown"
    },
    {
      "text": "陈醋（推荐镇江香醋或山西老陈醋）",
      "markdown": "陈醋（推荐镇江香醋或山西老陈醋）",
      "group": null,
      "kind": "unknown"
    },
    {
      "text": "白糖",
      "markdown": "白糖",
      "group": null,
      "kind": "unknown"
    },
    {
      "text": "香油",
      "markdown": "香油",
      "group": null,
      "kind": "unknown"
    },
    {
      "text": "熟白芝麻（可选，用于点缀）",
      "markdown": "熟白芝麻（可选，用于点缀）",
      "group": null,
      "kind": "unknown"
    }
  ],
  "requirementsMarkdown": "- 大白菜（取黄心嫩叶，冬季黄心白菜最佳）\r\n- 芝麻酱\r\n- 陈醋（推荐镇江香醋或山西老陈醋）\r\n- 白糖\r\n- 香油\r\n- 熟白芝麻（可选，用于点缀）",
  "ingredients": [
    {
      "name": "大白菜嫩叶",
      "text": "大白菜嫩叶 300g",
      "optional": false,
      "source": "calculation-list"
    },
    {
      "name": "芝麻酱",
      "text": "芝麻酱 30g（约 2 汤匙）",
      "optional": false,
      "source": "calculation-list"
    },
    {
      "name": "陈醋",
      "text": "陈醋 45ml（约 3 汤匙，醋与麻酱比例约 3:2）",
      "optional": false,
      "source": "calculation-list"
    },
    {
      "name": "白糖",
      "text": "白糖 5g（约 1 茶匙）",
      "optional": false,
      "source": "calculation-list"
    },
    {
      "name": "香油",
      "text": "香油 5ml",
      "optional": false,
      "source": "calculation-list"
    },
    {
      "name": "食盐",
      "text": "食盐 1g",
      "optional": false,
      "source": "calculation-list"
    },
    {
      "name": "熟白芝麻",
      "text": "熟白芝麻 3g（可选）",
      "optional": true,
      "source": "calculation-list"
    }
  ],
  "tools": [],
  "calculationMarkdown": "每次制作前需要确定计划做几份。一份正好够 2 个人吃。\r\n\r\n每份：\r\n\r\n- 大白菜嫩叶 300g\r\n- 芝麻酱 30g（约 2 汤匙）\r\n- 陈醋 45ml（约 3 汤匙，醋与麻酱比例约 3:2）\r\n- 白糖 5g（约 1 茶匙）\r\n- 香油 5ml\r\n- 食盐 1g\r\n- 熟白芝麻 3g（可选）",
  "calculationNotes": [
    "每次制作前需要确定计划做几份。一份正好够 2 个人吃。",
    "每份："
  ],
  "steps": [
    {
      "kind": "step",
      "description": "大白菜只取内部嫩叶（黄色部分），去除菜帮，用手撕成半个巴掌大的块，**不要用刀切**（手撕截面粗糙更易挂酱）"
    },
    {
      "kind": "step",
      "description": "将撕好的白菜叶冲洗干净，充分控干水分，水分残留会导致酱汁无法挂附"
    },
    {
      "kind": "step",
      "description": "碗中加入 30g 芝麻酱，**先加入 45ml 陈醋**，沿同一方向搅拌，将麻酱慢慢稀释开，直至*成细线状滴落*为止（切勿来回搅拌，会导致芝麻酱\"走油\"）"
    },
    {
      "kind": "step",
      "description": "向麻酱汁中加入 5g 白糖，搅拌均匀；再加入 1g 食盐，搅拌均匀；最后加入 5ml 香油，搅拌均匀（各调料需分次加入并分别搅拌，边加边感受稀稠度）"
    },
    {
      "kind": "step",
      "description": "将调好的麻酱汁均匀淋在白菜叶上，用手轻轻抓拌，使每片菜叶都裹上酱汁"
    },
    {
      "kind": "step",
      "description": "撒上熟白芝麻，装盘即可食用；若时间充裕，可**静置 5 分钟**待其入味后再食用"
    }
  ],
  "operationMarkdown": "1. 大白菜只取内部嫩叶（黄色部分），去除菜帮，用手撕成半个巴掌大的块，**不要用刀切**（手撕截面粗糙更易挂酱）\r\n2. 将撕好的白菜叶冲洗干净，充分控干水分，水分残留会导致酱汁无法挂附\r\n3. 碗中加入 30g 芝麻酱，**先加入 45ml 陈醋**，沿同一方向搅拌，将麻酱慢慢稀释开，直至*成细线状滴落*为止（切勿来回搅拌，会导致芝麻酱\"走油\"）\r\n4. 向麻酱汁中加入 5g 白糖，搅拌均匀；再加入 1g 食盐，搅拌均匀；最后加入 5ml 香油，搅拌均匀（各调料需分次加入并分别搅拌，边加边感受稀稠度）\r\n5. 将调好的麻酱汁均匀淋在白菜叶上，用手轻轻抓拌，使每片菜叶都裹上酱汁\r\n6. 撒上熟白芝麻，装盘即可食用；若时间充裕，可**静置 5 分钟**待其入味后再食用",
  "tips": "- 白菜控水是关键，越干越好；湿菜叶挂不住麻酱，整道菜口味会被稀释。\r\n- 调麻酱汁时必须先用醋\"解\"酱，再依次加入其他调料，切勿一次全部倒入。\r\n- 陈醋优先选用镇江香醋，颜色与酸香均最为适宜；不建议使用米醋（太淡）或白醋（色浅且味薄）。\r\n- 本配方为醋糖版，如希望口味更醇厚圆润，可将白糖的一半替换为蜂蜜。\r\n\r\n如果您遵循本指南的制作流程而发现有问题或可以改进的流程，请提出 Issue 或 Pull request 。",
  "warnings": [],
  "additionalMarkdown": "- 白菜控水是关键，越干越好；湿菜叶挂不住麻酱，整道菜口味会被稀释。\r\n- 调麻酱汁时必须先用醋\"解\"酱，再依次加入其他调料，切勿一次全部倒入。\r\n- 陈醋优先选用镇江香醋，颜色与酸香均最为适宜；不建议使用米醋（太淡）或白醋（色浅且味薄）。\r\n- 本配方为醋糖版，如希望口味更醇厚圆润，可将白糖的一半替换为蜂蜜。\r\n\r\n如果您遵循本指南的制作流程而发现有问题或可以改进的流程，请提出 Issue 或 Pull request 。",
  "images": [
    "images/vegetable_dish/c0819a92-6029-4c5e-a17f-3ecfce8e5210_0.webp"
  ],
  "externalImages": [],
  "source": {
    "repository": "https://github.com/Gaq152/HowToCook",
    "commit": "c05758fa661ac4efa0361a987b700a351a22159b",
    "path": "dishes/vegetable_dish/乾隆白菜/乾隆白菜.md"
  },
  "hash": "1a38e654038de737e89aa88c34c73c5ecc2f5283696574e7cf127e6997e631a4"
}
